<?xml version="1.0" encoding="utf-8"?>

<!ELEMENT könyvek (könyv*)>
<!ELEMENT könyv (cim, kiadasi_ev,kiado,szerzo,abstract*)>
<!ELEMENT cim (#PCDATA)>
<!ELEMENT kiadasi_ev (#PCDATA)>
<!ELEMENT kiado (#PCDATA)>
<!ELEMENT szerzo (#PCDATA)>
<!ELEMENT abstract (#PCDATA)>

